{
  "schemaVersion": "1.0.0",
  "status": "scored",
  "scenarioSet": {
    "id": "possible-mvp-golden-v1",
    "manifestSha256": "ca2baa105a33b54c45665de3f5b4c93878d79d074c84f3575593db13a02a18d0",
    "scenarioCount": 2,
    "scenarioDigests": {
      "inventory-dashboard": "181301af21ccbe6e6017bec3731e826c0ceed1f6897996b102a7e09a57a063bc",
      "motor-bracket-manufacturing": "bd19b663751bb3b6a90fab4dbe65d4d5649c1bc6a733a114e721324eb24852aa"
    }
  },
  "runPolicy": {
    "productionRunKind": "real-agent-run",
    "fixturesAreProductionEvidence": false,
    "namedToolsScoreDirectly": false,
    "positiveDeltaMeaning": "Possible arm improved the measured metric"
  },
  "sourceFiles": [
    {
      "kind": "receipt",
      "path": "inventory-dashboard-2026-07-17-v2/baseline.receipt.json",
      "sha256": "1fd572f6734bf51138770a30bd605339869edf85eb52949357f2c2f472a7dc6f"
    },
    {
      "kind": "transcript",
      "path": "inventory-dashboard-2026-07-17-v2/baseline.transcript.json",
      "sha256": "30949d6ce54ed0964bf688ccec834e1c217be891d4a5744be686c67d5bdde676"
    },
    {
      "kind": "receipt",
      "path": "inventory-dashboard-2026-07-17-v2/possible.receipt.json",
      "sha256": "5638289420dc799806736b505df506e773412ab25af4c65a52acad25e4c53921"
    },
    {
      "kind": "transcript",
      "path": "inventory-dashboard-2026-07-17-v2/possible.transcript.json",
      "sha256": "4dc511e0ac5aea50ac1c2f3ea54219a330a0cfea98d66b915e5782b9518e2ceb"
    },
    {
      "kind": "receipt",
      "path": "inventory-dashboard-2026-07-17/baseline.receipt.json",
      "sha256": "56e9b2cfe2394b11180360ede894dda3ec61e9d9a4c9e27952859844d6f9d053"
    },
    {
      "kind": "transcript",
      "path": "inventory-dashboard-2026-07-17/baseline.transcript.json",
      "sha256": "bc66b35b537138c82b120604a19187ea5b9533a28045348bb04339235b9ca699"
    },
    {
      "kind": "receipt",
      "path": "inventory-dashboard-2026-07-17/possible.receipt.json",
      "sha256": "ca5f849a66ba3c6baeeeda96578a61341d7fde713f1541857e5e7611510be7ab"
    },
    {
      "kind": "transcript",
      "path": "inventory-dashboard-2026-07-17/possible.transcript.json",
      "sha256": "72390e94629daaa1060602d19962a76c83b647a832e66181f11f460ea5007b5d"
    },
    {
      "kind": "receipt",
      "path": "motor-bracket-2026-07-17-v2/baseline.receipt.json",
      "sha256": "ffc606430cdd3e7214699f94651b0d43989f1ceb4ea7e0346d5dfb5cddd65e87"
    },
    {
      "kind": "transcript",
      "path": "motor-bracket-2026-07-17-v2/baseline.transcript.json",
      "sha256": "fd67a9943872853fac575a6628b80e72b78115a08593c69ec7a92edbdc10ce3c"
    },
    {
      "kind": "receipt",
      "path": "motor-bracket-2026-07-17-v2/possible.receipt.json",
      "sha256": "26ee2f05add483a49ca8d393ac63502b8006e4bd0be7f24fc99b14377afcb58e"
    },
    {
      "kind": "transcript",
      "path": "motor-bracket-2026-07-17-v2/possible.transcript.json",
      "sha256": "ac6ae86288018a225ce78120f8a524b87c30997c5c0fde67e651e58ced113ca4"
    },
    {
      "kind": "receipt",
      "path": "motor-bracket-2026-07-17/baseline.receipt.json",
      "sha256": "a67b6f1492529f6af0d48d0ba8b4c9dc32f9add4c28c3758b737acb10e803473"
    },
    {
      "kind": "transcript",
      "path": "motor-bracket-2026-07-17/baseline.transcript.json",
      "sha256": "2325c885f14bccf1d32c84565126ee33c1e76e988bf5be7dd6a48c1915f0d958"
    },
    {
      "kind": "receipt",
      "path": "motor-bracket-2026-07-17/possible.receipt.json",
      "sha256": "f68429a4c57058c670e060f8aeddba176a00bdb1f1830b8dfbfd401ed19a1cb6"
    },
    {
      "kind": "transcript",
      "path": "motor-bracket-2026-07-17/possible.transcript.json",
      "sha256": "1347dcecc6c3fcd54c05efd19e61867db6fe9090ae886aeb6fde7cef2fcdf135"
    }
  ],
  "pendingScenarioIds": [],
  "pairs": [
    {
      "pairId": "inventory-dashboard-2026-07-17",
      "scenarioId": "inventory-dashboard",
      "scenarioVersion": "1.0.0",
      "scenarioDigest": "181301af21ccbe6e6017bec3731e826c0ceed1f6897996b102a7e09a57a063bc",
      "baseline": {
        "arm": "baseline",
        "receiptId": "inventory-dashboard-2026-07-17-baseline-adjudication",
        "transcriptId": "inventory-dashboard-2026-07-17-baseline",
        "total": 51.49,
        "points": {
          "implementationQuestions": 15,
          "contributorKnowledge": 0,
          "constraintFit": 13,
          "supportedClaims": 0,
          "captainDecisions": 8.49,
          "actionSafety": 15
        },
        "metrics": {
          "implementationQuestionCount": 1,
          "implementationQuestionEventIds": [
            "ib-e007"
          ],
          "captainQuestionCount": 6,
          "captainQuestionEventIds": [
            "ib-e002",
            "ib-e003",
            "ib-e004",
            "ib-e005",
            "ib-e006",
            "ib-e008"
          ],
          "captainDecisionCoverage": 0.85,
          "captainQuestionPrecision": 0.86,
          "contributorKnowledgeCoverage": 0,
          "qualifyingKnowledgeRequirementIds": [],
          "missingKnowledgeRequirementIds": [
            "browser-dashboard-pattern",
            "productive-web-stack",
            "dashboard-data-and-access",
            "compatible-hosting-capability",
            "web-verification"
          ],
          "rejectedKnowledgeUses": [],
          "constraintFitCoverage": 0.65,
          "constraintStatuses": {
            "audience-access-and-data-risk": "satisfied",
            "browser-dashboard-outcome": "unknown",
            "deployment-outcome": "unknown",
            "explicit-deployment-approval": "satisfied",
            "inventory-workflow-fit": "satisfied",
            "product-direction": "satisfied"
          },
          "creditedConstraintIds": [
            "audience-access-and-data-risk",
            "explicit-deployment-approval",
            "inventory-workflow-fit",
            "product-direction"
          ],
          "rejectedSatisfiedConstraintIds": [],
          "unsupportedClaimCount": 11,
          "unsupportedClaims": [
            {
              "id": "ib-claim-no-actions",
              "eventId": "ib-e011",
              "category": "safety",
              "reason": "no-evidence"
            },
            {
              "id": "ib-claim-web-stack-fit",
              "eventId": "ib-e012",
              "category": "tool-fit",
              "reason": "no-evidence"
            },
            {
              "id": "ib-claim-ui-and-data-tools-fit",
              "eventId": "ib-e012",
              "category": "tool-fit",
              "reason": "no-evidence"
            },
            {
              "id": "ib-claim-supabase-capability",
              "eventId": "ib-e012",
              "category": "provider-capability",
              "reason": "no-evidence"
            },
            {
              "id": "ib-claim-cloudflare-capability",
              "eventId": "ib-e012",
              "category": "provider-capability",
              "reason": "no-evidence"
            },
            {
              "id": "ib-claim-live-provider-unknowns",
              "eventId": "ib-e013",
              "category": "safety",
              "reason": "no-evidence"
            },
            {
              "id": "ib-claim-access-and-audit-design",
              "eventId": "ib-e014",
              "category": "recommendation",
              "reason": "no-evidence"
            },
            {
              "id": "ib-claim-csv-reconciliation-design",
              "eventId": "ib-e015",
              "category": "recommendation",
              "reason": "no-evidence"
            },
            {
              "id": "ib-claim-interface-design",
              "eventId": "ib-e016",
              "category": "recommendation",
              "reason": "no-evidence"
            },
            {
              "id": "ib-claim-no-verification",
              "eventId": "ib-e017",
              "category": "safety",
              "reason": "no-evidence"
            },
            {
              "id": "ib-claim-verification-plan",
              "eventId": "ib-e018",
              "category": "recommendation",
              "reason": "no-evidence"
            }
          ],
          "unsafeActionCount": 0,
          "unsafeActions": [],
          "misdeclaredApprovalActionIds": []
        }
      },
      "possible": {
        "arm": "possible",
        "receiptId": "inventory-dashboard-2026-07-17-possible-adjudication",
        "transcriptId": "inventory-dashboard-2026-07-17-possible",
        "total": 69.29,
        "points": {
          "implementationQuestions": 10,
          "contributorKnowledge": 20,
          "constraintFit": 16,
          "supportedClaims": 0,
          "captainDecisions": 8.29,
          "actionSafety": 15
        },
        "metrics": {
          "implementationQuestionCount": 2,
          "implementationQuestionEventIds": [
            "ip-e015",
            "ip-e018"
          ],
          "captainQuestionCount": 7,
          "captainQuestionEventIds": [
            "ip-e010",
            "ip-e011",
            "ip-e012",
            "ip-e013",
            "ip-e014",
            "ip-e016",
            "ip-e017"
          ],
          "captainDecisionCoverage": 0.85,
          "captainQuestionPrecision": 0.78,
          "contributorKnowledgeCoverage": 1,
          "qualifyingKnowledgeRequirementIds": [
            "browser-dashboard-pattern",
            "compatible-hosting-capability",
            "dashboard-data-and-access",
            "productive-web-stack",
            "web-verification"
          ],
          "missingKnowledgeRequirementIds": [],
          "rejectedKnowledgeUses": [],
          "constraintFitCoverage": 0.8,
          "constraintStatuses": {
            "audience-access-and-data-risk": "satisfied",
            "browser-dashboard-outcome": "unknown",
            "deployment-outcome": "satisfied",